{
    "phase": "security",
    "risk_score": "LOW",
    "threat_model": [
        {
            "threat": "Spoofing: Malicious repo URL in manifest",
            "mitigation": "Validate URL matches known source before fetching",
            "status": "MITIGATED"
        },
        {
            "threat": "Tampering: Corrupted update introduces malicious code",
            "mitigation": "Checksum validation of all files before applying update",
            "status": "MITIGATED"
        },
        {
            "threat": "Tampering: Man-in-the-middle during git fetch",
            "mitigation": "Use HTTPS, rely on git's built-in integrity checks",
            "status": "MITIGATED"
        },
        {
            "threat": "Repudiation: No audit trail of updates",
            "mitigation": "Manifest tracks version history with timestamps",
            "status": "MITIGATED"
        },
        {
            "threat": "DoS: Script hangs on network issues",
            "mitigation": "Timeout on git operations (30 seconds)",
            "status": "MITIGATED"
        },
        {
            "threat": "Elevation of Privilege: Script runs with elevated permissions",
            "mitigation": "No sudo required, respects user file permissions",
            "status": "MITIGATED"
        }
    ],
    "auth_review": {
        "new_permissions": false,
        "sensitive_data_exposure": false
    }
}